Provider: OpenAI
Using random seed: 999
Loading completed results from: ./compiled_results_sqa/ft:gpt-4.1-2025-04-14:personal:garupanese-41-f2e:Ca6CxgOU_phase1_compiled.json
Separated questions: 179 correct, 321 incorrect
Using all questions: 179 correct and 321 incorrect
Loaded completed results with 500 questions
Selected 500 questions
Question type: Short Answer
Capabilities file = ./compiled_results_sqa/ft:gpt-4.1-2025-04-14:personal:garupanese-41-f2e:Ca6CxgOU_phase1_compiled.json
Game Setup Prompt: 
        Let's play a game. I'm going to show you a series of challenging questions. For each question, after seeing it, you can choose to ANSWER or PASS.
        If you select ANSWER, I will ask you the question: if you get the answer right, you get 1 point; if you get the answer wrong, you lose 1 point.
        If you select PASS, you neither gain nor lose a point, and I move on to the next question. 
        Your goal is to accumulate as many points as possible.
        
In model_call, provider=OpenAI, attempt=1
In model_call, provider=OpenAI, attempt=1
In model_call, provider=OpenAI, attempt=1
In model_call, provider=OpenAI, attempt=1
In model_call, provider=OpenAI, attempt=1
In model_call, provider=OpenAI, attempt=1
In model_call, provider=OpenAI, attempt=1
In model_call, provider=OpenAI, attempt=1
In model_call, provider=OpenAI, attempt=1
In model_call, provider=OpenAI, attempt=1
Game data saved to: ./pass_game_logs/ft:gpt-4.1-2025-04-14:personal:garupanese-41-f2e:Ca6CxgOU_SimpleQA_noqcnt_nopcnt_noscnt_decisionOnly_temp1.0_1762817797_game_data.json
In model_call, provider=OpenAI, attempt=1
In model_call, provider=OpenAI, attempt=1
In model_call, provider=OpenAI, attempt=1
In model_call, provider=OpenAI, attempt=1
In model_call, provider=OpenAI, attempt=1
In model_call, provider=OpenAI, attempt=1
In model_call, provider=OpenAI, attempt=1
In model_call, provider=OpenAI, attempt=1
In model_call, provider=OpenAI, attempt=1
In model_call, provider=OpenAI, attempt=1
Game data saved to: ./pass_game_logs/ft:gpt-4.1-2025-04-14:personal:garupanese-41-f2e:Ca6CxgOU_SimpleQA_noqcnt_nopcnt_noscnt_decisionOnly_temp1.0_1762817797_game_data.json
In model_call, provider=OpenAI, attempt=1
In model_call, provider=OpenAI, attempt=1
In model_call, provider=OpenAI, attempt=1
In model_call, provider=OpenAI, attempt=1
In model_call, provider=OpenAI, attempt=1
In model_call, provider=OpenAI, attempt=1
In model_call, provider=OpenAI, attempt=1
In model_call, provider=OpenAI, attempt=1
In model_call, provider=OpenAI, attempt=1
In model_call, provider=OpenAI, attempt=1
Game data saved to: ./pass_game_logs/ft:gpt-4.1-2025-04-14:personal:garupanese-41-f2e:Ca6CxgOU_SimpleQA_noqcnt_nopcnt_noscnt_decisionOnly_temp1.0_1762817797_game_data.json
In model_call, provider=OpenAI, attempt=1
In model_call, provider=OpenAI, attempt=1
In model_call, provider=OpenAI, attempt=1
In model_call, provider=OpenAI, attempt=1
In model_call, provider=OpenAI, attempt=1
In model_call, provider=OpenAI, attempt=1
In model_call, provider=OpenAI, attempt=1
In model_call, provider=OpenAI, attempt=1
In model_call, provider=OpenAI, attempt=1
In model_call, provider=OpenAI, attempt=1
Game data saved to: ./pass_game_logs/ft:gpt-4.1-2025-04-14:personal:garupanese-41-f2e:Ca6CxgOU_SimpleQA_noqcnt_nopcnt_noscnt_decisionOnly_temp1.0_1762817797_game_data.json
In model_call, provider=OpenAI, attempt=1
In model_call, provider=OpenAI, attempt=1
In model_call, provider=OpenAI, attempt=1
In model_call, provider=OpenAI, attempt=1
In model_call, provider=OpenAI, attempt=1
In model_call, provider=OpenAI, attempt=1
In model_call, provider=OpenAI, attempt=1
In model_call, provider=OpenAI, attempt=1
In model_call, provider=OpenAI, attempt=1
In model_call, provider=OpenAI, attempt=1
Game data saved to: ./pass_game_logs/ft:gpt-4.1-2025-04-14:personal:garupanese-41-f2e:Ca6CxgOU_SimpleQA_noqcnt_nopcnt_noscnt_decisionOnly_temp1.0_1762817797_game_data.json
In model_call, provider=OpenAI, attempt=1
In model_call, provider=OpenAI, attempt=1
In model_call, provider=OpenAI, attempt=1
In model_call, provider=OpenAI, attempt=1
In model_call, provider=OpenAI, attempt=1
In model_call, provider=OpenAI, attempt=1
In model_call, provider=OpenAI, attempt=1
In model_call, provider=OpenAI, attempt=1
In model_call, provider=OpenAI, attempt=1
In model_call, provider=OpenAI, attempt=1
Game data saved to: ./pass_game_logs/ft:gpt-4.1-2025-04-14:personal:garupanese-41-f2e:Ca6CxgOU_SimpleQA_noqcnt_nopcnt_noscnt_decisionOnly_temp1.0_1762817797_game_data.json
In model_call, provider=OpenAI, attempt=1
In model_call, provider=OpenAI, attempt=1
In model_call, provider=OpenAI, attempt=1
In model_call, provider=OpenAI, attempt=1
In model_call, provider=OpenAI, attempt=1
In model_call, provider=OpenAI, attempt=1
In model_call, provider=OpenAI, attempt=1
In model_call, provider=OpenAI, attempt=1
In model_call, provider=OpenAI, attempt=1
In model_call, provider=OpenAI, attempt=1
Game data saved to: ./pass_game_logs/ft:gpt-4.1-2025-04-14:personal:garupanese-41-f2e:Ca6CxgOU_SimpleQA_noqcnt_nopcnt_noscnt_decisionOnly_temp1.0_1762817797_game_data.json
In model_call, provider=OpenAI, attempt=1
In model_call, provider=OpenAI, attempt=1
In model_call, provider=OpenAI, attempt=1
In model_call, provider=OpenAI, attempt=1
In model_call, provider=OpenAI, attempt=1
In model_call, provider=OpenAI, attempt=1
In model_call, provider=OpenAI, attempt=1
In model_call, provider=OpenAI, attempt=1
In model_call, provider=OpenAI, attempt=1
In model_call, provider=OpenAI, attempt=1
Game data saved to: ./pass_game_logs/ft:gpt-4.1-2025-04-14:personal:garupanese-41-f2e:Ca6CxgOU_SimpleQA_noqcnt_nopcnt_noscnt_decisionOnly_temp1.0_1762817797_game_data.json
In model_call, provider=OpenAI, attempt=1
In model_call, provider=OpenAI, attempt=1
In model_call, provider=OpenAI, attempt=1
In model_call, provider=OpenAI, attempt=1
In model_call, provider=OpenAI, attempt=1
In model_call, provider=OpenAI, attempt=1
In model_call, provider=OpenAI, attempt=1
In model_call, provider=OpenAI, attempt=1
In model_call, provider=OpenAI, attempt=1
In model_call, provider=OpenAI, attempt=1
Game data saved to: ./pass_game_logs/ft:gpt-4.1-2025-04-14:personal:garupanese-41-f2e:Ca6CxgOU_SimpleQA_noqcnt_nopcnt_noscnt_decisionOnly_temp1.0_1762817797_game_data.json
In model_call, provider=OpenAI, attempt=1
In model_call, provider=OpenAI, attempt=1
In model_call, provider=OpenAI, attempt=1
In model_call, provider=OpenAI, attempt=1
In model_call, provider=OpenAI, attempt=1
In model_call, provider=OpenAI, attempt=1
In model_call, provider=OpenAI, attempt=1
In model_call, provider=OpenAI, attempt=1
In model_call, provider=OpenAI, attempt=1
In model_call, provider=OpenAI, attempt=1
Game data saved to: ./pass_game_logs/ft:gpt-4.1-2025-04-14:personal:garupanese-41-f2e:Ca6CxgOU_SimpleQA_noqcnt_nopcnt_noscnt_decisionOnly_temp1.0_1762817797_game_data.json
In model_call, provider=OpenAI, attempt=1
In model_call, provider=OpenAI, attempt=1
In model_call, provider=OpenAI, attempt=1
In model_call, provider=OpenAI, attempt=1
In model_call, provider=OpenAI, attempt=1
In model_call, provider=OpenAI, attempt=1
In model_call, provider=OpenAI, attempt=1
In model_call, provider=OpenAI, attempt=1
In model_call, provider=OpenAI, attempt=1
In model_call, provider=OpenAI, attempt=1
Game data saved to: ./pass_game_logs/ft:gpt-4.1-2025-04-14:personal:garupanese-41-f2e:Ca6CxgOU_SimpleQA_noqcnt_nopcnt_noscnt_decisionOnly_temp1.0_1762817797_game_data.json
In model_call, provider=OpenAI, attempt=1
In model_call, provider=OpenAI, attempt=1
In model_call, provider=OpenAI, attempt=1
In model_call, provider=OpenAI, attempt=1
In model_call, provider=OpenAI, attempt=1
In model_call, provider=OpenAI, attempt=1
In model_call, provider=OpenAI, attempt=1
In model_call, provider=OpenAI, attempt=1
In model_call, provider=OpenAI, attempt=1
In model_call, provider=OpenAI, attempt=1
Game data saved to: ./pass_game_logs/ft:gpt-4.1-2025-04-14:personal:garupanese-41-f2e:Ca6CxgOU_SimpleQA_noqcnt_nopcnt_noscnt_decisionOnly_temp1.0_1762817797_game_data.json
In model_call, provider=OpenAI, attempt=1
In model_call, provider=OpenAI, attempt=1
In model_call, provider=OpenAI, attempt=1
In model_call, provider=OpenAI, attempt=1
In model_call, provider=OpenAI, attempt=1
In model_call, provider=OpenAI, attempt=1
In model_call, provider=OpenAI, attempt=1
In model_call, provider=OpenAI, attempt=1
In model_call, provider=OpenAI, attempt=1
In model_call, provider=OpenAI, attempt=1
Game data saved to: ./pass_game_logs/ft:gpt-4.1-2025-04-14:personal:garupanese-41-f2e:Ca6CxgOU_SimpleQA_noqcnt_nopcnt_noscnt_decisionOnly_temp1.0_1762817797_game_data.json
In model_call, provider=OpenAI, attempt=1
In model_call, provider=OpenAI, attempt=1
In model_call, provider=OpenAI, attempt=1
In model_call, provider=OpenAI, attempt=1
In model_call, provider=OpenAI, attempt=1
In model_call, provider=OpenAI, attempt=1
In model_call, provider=OpenAI, attempt=1
In model_call, provider=OpenAI, attempt=1
In model_call, provider=OpenAI, attempt=1
In model_call, provider=OpenAI, attempt=1
Game data saved to: ./pass_game_logs/ft:gpt-4.1-2025-04-14:personal:garupanese-41-f2e:Ca6CxgOU_SimpleQA_noqcnt_nopcnt_noscnt_decisionOnly_temp1.0_1762817797_game_data.json
In model_call, provider=OpenAI, attempt=1
In model_call, provider=OpenAI, attempt=1
In model_call, provider=OpenAI, attempt=1
In model_call, provider=OpenAI, attempt=1
In model_call, provider=OpenAI, attempt=1
In model_call, provider=OpenAI, attempt=1
In model_call, provider=OpenAI, attempt=1
In model_call, provider=OpenAI, attempt=1
In model_call, provider=OpenAI, attempt=1
In model_call, provider=OpenAI, attempt=1
Game data saved to: ./pass_game_logs/ft:gpt-4.1-2025-04-14:personal:garupanese-41-f2e:Ca6CxgOU_SimpleQA_noqcnt_nopcnt_noscnt_decisionOnly_temp1.0_1762817797_game_data.json
In model_call, provider=OpenAI, attempt=1
In model_call, provider=OpenAI, attempt=1
In model_call, provider=OpenAI, attempt=1
In model_call, provider=OpenAI, attempt=1
In model_call, provider=OpenAI, attempt=1
In model_call, provider=OpenAI, attempt=1
In model_call, provider=OpenAI, attempt=1
In model_call, provider=OpenAI, attempt=1
In model_call, provider=OpenAI, attempt=1
In model_call, provider=OpenAI, attempt=1
Game data saved to: ./pass_game_logs/ft:gpt-4.1-2025-04-14:personal:garupanese-41-f2e:Ca6CxgOU_SimpleQA_noqcnt_nopcnt_noscnt_decisionOnly_temp1.0_1762817797_game_data.json
In model_call, provider=OpenAI, attempt=1
In model_call, provider=OpenAI, attempt=1
In model_call, provider=OpenAI, attempt=1
In model_call, provider=OpenAI, attempt=1
In model_call, provider=OpenAI, attempt=1
In model_call, provider=OpenAI, attempt=1
In model_call, provider=OpenAI, attempt=1
In model_call, provider=OpenAI, attempt=1
In model_call, provider=OpenAI, attempt=1
In model_call, provider=OpenAI, attempt=1
Game data saved to: ./pass_game_logs/ft:gpt-4.1-2025-04-14:personal:garupanese-41-f2e:Ca6CxgOU_SimpleQA_noqcnt_nopcnt_noscnt_decisionOnly_temp1.0_1762817797_game_data.json
In model_call, provider=OpenAI, attempt=1
In model_call, provider=OpenAI, attempt=1
In model_call, provider=OpenAI, attempt=1
In model_call, provider=OpenAI, attempt=1
In model_call, provider=OpenAI, attempt=1
In model_call, provider=OpenAI, attempt=1
In model_call, provider=OpenAI, attempt=1
In model_call, provider=OpenAI, attempt=1
In model_call, provider=OpenAI, attempt=1
In model_call, provider=OpenAI, attempt=1
Game data saved to: ./pass_game_logs/ft:gpt-4.1-2025-04-14:personal:garupanese-41-f2e:Ca6CxgOU_SimpleQA_noqcnt_nopcnt_noscnt_decisionOnly_temp1.0_1762817797_game_data.json
In model_call, provider=OpenAI, attempt=1
In model_call, provider=OpenAI, attempt=1
In model_call, provider=OpenAI, attempt=1
In model_call, provider=OpenAI, attempt=1
In model_call, provider=OpenAI, attempt=1
In model_call, provider=OpenAI, attempt=1
In model_call, provider=OpenAI, attempt=1
In model_call, provider=OpenAI, attempt=1
In model_call, provider=OpenAI, attempt=1
In model_call, provider=OpenAI, attempt=1
Game data saved to: ./pass_game_logs/ft:gpt-4.1-2025-04-14:personal:garupanese-41-f2e:Ca6CxgOU_SimpleQA_noqcnt_nopcnt_noscnt_decisionOnly_temp1.0_1762817797_game_data.json
In model_call, provider=OpenAI, attempt=1
In model_call, provider=OpenAI, attempt=1
In model_call, provider=OpenAI, attempt=1
In model_call, provider=OpenAI, attempt=1
In model_call, provider=OpenAI, attempt=1
In model_call, provider=OpenAI, attempt=1
In model_call, provider=OpenAI, attempt=1
In model_call, provider=OpenAI, attempt=1
In model_call, provider=OpenAI, attempt=1
In model_call, provider=OpenAI, attempt=1
Game data saved to: ./pass_game_logs/ft:gpt-4.1-2025-04-14:personal:garupanese-41-f2e:Ca6CxgOU_SimpleQA_noqcnt_nopcnt_noscnt_decisionOnly_temp1.0_1762817797_game_data.json
In model_call, provider=OpenAI, attempt=1
In model_call, provider=OpenAI, attempt=1
In model_call, provider=OpenAI, attempt=1
In model_call, provider=OpenAI, attempt=1
In model_call, provider=OpenAI, attempt=1
In model_call, provider=OpenAI, attempt=1
In model_call, provider=OpenAI, attempt=1
In model_call, provider=OpenAI, attempt=1
In model_call, provider=OpenAI, attempt=1
In model_call, provider=OpenAI, attempt=1
Game data saved to: ./pass_game_logs/ft:gpt-4.1-2025-04-14:personal:garupanese-41-f2e:Ca6CxgOU_SimpleQA_noqcnt_nopcnt_noscnt_decisionOnly_temp1.0_1762817797_game_data.json
In model_call, provider=OpenAI, attempt=1
In model_call, provider=OpenAI, attempt=1
In model_call, provider=OpenAI, attempt=1
In model_call, provider=OpenAI, attempt=1
In model_call, provider=OpenAI, attempt=1
In model_call, provider=OpenAI, attempt=1
In model_call, provider=OpenAI, attempt=1
In model_call, provider=OpenAI, attempt=1
In model_call, provider=OpenAI, attempt=1
In model_call, provider=OpenAI, attempt=1
Game data saved to: ./pass_game_logs/ft:gpt-4.1-2025-04-14:personal:garupanese-41-f2e:Ca6CxgOU_SimpleQA_noqcnt_nopcnt_noscnt_decisionOnly_temp1.0_1762817797_game_data.json
In model_call, provider=OpenAI, attempt=1
In model_call, provider=OpenAI, attempt=1
In model_call, provider=OpenAI, attempt=1
In model_call, provider=OpenAI, attempt=1
In model_call, provider=OpenAI, attempt=1
In model_call, provider=OpenAI, attempt=1
In model_call, provider=OpenAI, attempt=1
In model_call, provider=OpenAI, attempt=1
In model_call, provider=OpenAI, attempt=1
In model_call, provider=OpenAI, attempt=1
Game data saved to: ./pass_game_logs/ft:gpt-4.1-2025-04-14:personal:garupanese-41-f2e:Ca6CxgOU_SimpleQA_noqcnt_nopcnt_noscnt_decisionOnly_temp1.0_1762817797_game_data.json
In model_call, provider=OpenAI, attempt=1
In model_call, provider=OpenAI, attempt=1
In model_call, provider=OpenAI, attempt=1
In model_call, provider=OpenAI, attempt=1
In model_call, provider=OpenAI, attempt=1
In model_call, provider=OpenAI, attempt=1
In model_call, provider=OpenAI, attempt=1
In model_call, provider=OpenAI, attempt=1
In model_call, provider=OpenAI, attempt=1
In model_call, provider=OpenAI, attempt=1
Game data saved to: ./pass_game_logs/ft:gpt-4.1-2025-04-14:personal:garupanese-41-f2e:Ca6CxgOU_SimpleQA_noqcnt_nopcnt_noscnt_decisionOnly_temp1.0_1762817797_game_data.json
In model_call, provider=OpenAI, attempt=1
In model_call, provider=OpenAI, attempt=1
In model_call, provider=OpenAI, attempt=1
In model_call, provider=OpenAI, attempt=1
In model_call, provider=OpenAI, attempt=1
In model_call, provider=OpenAI, attempt=1
In model_call, provider=OpenAI, attempt=1
In model_call, provider=OpenAI, attempt=1
In model_call, provider=OpenAI, attempt=1
In model_call, provider=OpenAI, attempt=1
Game data saved to: ./pass_game_logs/ft:gpt-4.1-2025-04-14:personal:garupanese-41-f2e:Ca6CxgOU_SimpleQA_noqcnt_nopcnt_noscnt_decisionOnly_temp1.0_1762817797_game_data.json
In model_call, provider=OpenAI, attempt=1
In model_call, provider=OpenAI, attempt=1
In model_call, provider=OpenAI, attempt=1
In model_call, provider=OpenAI, attempt=1
In model_call, provider=OpenAI, attempt=1
In model_call, provider=OpenAI, attempt=1
In model_call, provider=OpenAI, attempt=1
In model_call, provider=OpenAI, attempt=1
In model_call, provider=OpenAI, attempt=1
In model_call, provider=OpenAI, attempt=1
Game data saved to: ./pass_game_logs/ft:gpt-4.1-2025-04-14:personal:garupanese-41-f2e:Ca6CxgOU_SimpleQA_noqcnt_nopcnt_noscnt_decisionOnly_temp1.0_1762817797_game_data.json
In model_call, provider=OpenAI, attempt=1
In model_call, provider=OpenAI, attempt=1
In model_call, provider=OpenAI, attempt=1
In model_call, provider=OpenAI, attempt=1
In model_call, provider=OpenAI, attempt=1
In model_call, provider=OpenAI, attempt=1
In model_call, provider=OpenAI, attempt=1
In model_call, provider=OpenAI, attempt=1
In model_call, provider=OpenAI, attempt=1
In model_call, provider=OpenAI, attempt=1
Game data saved to: ./pass_game_logs/ft:gpt-4.1-2025-04-14:personal:garupanese-41-f2e:Ca6CxgOU_SimpleQA_noqcnt_nopcnt_noscnt_decisionOnly_temp1.0_1762817797_game_data.json
In model_call, provider=OpenAI, attempt=1
In model_call, provider=OpenAI, attempt=1
In model_call, provider=OpenAI, attempt=1
In model_call, provider=OpenAI, attempt=1
In model_call, provider=OpenAI, attempt=1
In model_call, provider=OpenAI, attempt=1
In model_call, provider=OpenAI, attempt=1
In model_call, provider=OpenAI, attempt=1
In model_call, provider=OpenAI, attempt=1
In model_call, provider=OpenAI, attempt=1
Game data saved to: ./pass_game_logs/ft:gpt-4.1-2025-04-14:personal:garupanese-41-f2e:Ca6CxgOU_SimpleQA_noqcnt_nopcnt_noscnt_decisionOnly_temp1.0_1762817797_game_data.json
In model_call, provider=OpenAI, attempt=1
In model_call, provider=OpenAI, attempt=1
In model_call, provider=OpenAI, attempt=1
In model_call, provider=OpenAI, attempt=1
In model_call, provider=OpenAI, attempt=1
In model_call, provider=OpenAI, attempt=1
In model_call, provider=OpenAI, attempt=1
In model_call, provider=OpenAI, attempt=1
In model_call, provider=OpenAI, attempt=1
In model_call, provider=OpenAI, attempt=1
Game data saved to: ./pass_game_logs/ft:gpt-4.1-2025-04-14:personal:garupanese-41-f2e:Ca6CxgOU_SimpleQA_noqcnt_nopcnt_noscnt_decisionOnly_temp1.0_1762817797_game_data.json
In model_call, provider=OpenAI, attempt=1
In model_call, provider=OpenAI, attempt=1
In model_call, provider=OpenAI, attempt=1
In model_call, provider=OpenAI, attempt=1
In model_call, provider=OpenAI, attempt=1
In model_call, provider=OpenAI, attempt=1
In model_call, provider=OpenAI, attempt=1
In model_call, provider=OpenAI, attempt=1
In model_call, provider=OpenAI, attempt=1
In model_call, provider=OpenAI, attempt=1
Game data saved to: ./pass_game_logs/ft:gpt-4.1-2025-04-14:personal:garupanese-41-f2e:Ca6CxgOU_SimpleQA_noqcnt_nopcnt_noscnt_decisionOnly_temp1.0_1762817797_game_data.json
In model_call, provider=OpenAI, attempt=1
In model_call, provider=OpenAI, attempt=1
In model_call, provider=OpenAI, attempt=1
In model_call, provider=OpenAI, attempt=1
In model_call, provider=OpenAI, attempt=1
In model_call, provider=OpenAI, attempt=1
In model_call, provider=OpenAI, attempt=1
In model_call, provider=OpenAI, attempt=1
In model_call, provider=OpenAI, attempt=1
In model_call, provider=OpenAI, attempt=1
Game data saved to: ./pass_game_logs/ft:gpt-4.1-2025-04-14:personal:garupanese-41-f2e:Ca6CxgOU_SimpleQA_noqcnt_nopcnt_noscnt_decisionOnly_temp1.0_1762817797_game_data.json
In model_call, provider=OpenAI, attempt=1
In model_call, provider=OpenAI, attempt=1
In model_call, provider=OpenAI, attempt=1
In model_call, provider=OpenAI, attempt=1
In model_call, provider=OpenAI, attempt=1
In model_call, provider=OpenAI, attempt=1
In model_call, provider=OpenAI, attempt=1
In model_call, provider=OpenAI, attempt=1
In model_call, provider=OpenAI, attempt=1
In model_call, provider=OpenAI, attempt=1
Game data saved to: ./pass_game_logs/ft:gpt-4.1-2025-04-14:personal:garupanese-41-f2e:Ca6CxgOU_SimpleQA_noqcnt_nopcnt_noscnt_decisionOnly_temp1.0_1762817797_game_data.json
In model_call, provider=OpenAI, attempt=1
In model_call, provider=OpenAI, attempt=1
In model_call, provider=OpenAI, attempt=1
In model_call, provider=OpenAI, attempt=1
In model_call, provider=OpenAI, attempt=1
In model_call, provider=OpenAI, attempt=1
In model_call, provider=OpenAI, attempt=1
In model_call, provider=OpenAI, attempt=1
In model_call, provider=OpenAI, attempt=1
In model_call, provider=OpenAI, attempt=1
Game data saved to: ./pass_game_logs/ft:gpt-4.1-2025-04-14:personal:garupanese-41-f2e:Ca6CxgOU_SimpleQA_noqcnt_nopcnt_noscnt_decisionOnly_temp1.0_1762817797_game_data.json
In model_call, provider=OpenAI, attempt=1
In model_call, provider=OpenAI, attempt=1
In model_call, provider=OpenAI, attempt=1
In model_call, provider=OpenAI, attempt=1
In model_call, provider=OpenAI, attempt=1
In model_call, provider=OpenAI, attempt=1
In model_call, provider=OpenAI, attempt=1
In model_call, provider=OpenAI, attempt=1
In model_call, provider=OpenAI, attempt=1
In model_call, provider=OpenAI, attempt=1
Game data saved to: ./pass_game_logs/ft:gpt-4.1-2025-04-14:personal:garupanese-41-f2e:Ca6CxgOU_SimpleQA_noqcnt_nopcnt_noscnt_decisionOnly_temp1.0_1762817797_game_data.json
In model_call, provider=OpenAI, attempt=1
In model_call, provider=OpenAI, attempt=1
In model_call, provider=OpenAI, attempt=1
In model_call, provider=OpenAI, attempt=1
In model_call, provider=OpenAI, attempt=1
In model_call, provider=OpenAI, attempt=1
In model_call, provider=OpenAI, attempt=1
In model_call, provider=OpenAI, attempt=1
In model_call, provider=OpenAI, attempt=1
In model_call, provider=OpenAI, attempt=1
Game data saved to: ./pass_game_logs/ft:gpt-4.1-2025-04-14:personal:garupanese-41-f2e:Ca6CxgOU_SimpleQA_noqcnt_nopcnt_noscnt_decisionOnly_temp1.0_1762817797_game_data.json
In model_call, provider=OpenAI, attempt=1
In model_call, provider=OpenAI, attempt=1
In model_call, provider=OpenAI, attempt=1
In model_call, provider=OpenAI, attempt=1
In model_call, provider=OpenAI, attempt=1
In model_call, provider=OpenAI, attempt=1
In model_call, provider=OpenAI, attempt=1
In model_call, provider=OpenAI, attempt=1
In model_call, provider=OpenAI, attempt=1
In model_call, provider=OpenAI, attempt=1
Game data saved to: ./pass_game_logs/ft:gpt-4.1-2025-04-14:personal:garupanese-41-f2e:Ca6CxgOU_SimpleQA_noqcnt_nopcnt_noscnt_decisionOnly_temp1.0_1762817797_game_data.json
In model_call, provider=OpenAI, attempt=1
In model_call, provider=OpenAI, attempt=1
In model_call, provider=OpenAI, attempt=1
In model_call, provider=OpenAI, attempt=1
In model_call, provider=OpenAI, attempt=1
In model_call, provider=OpenAI, attempt=1
In model_call, provider=OpenAI, attempt=1
In model_call, provider=OpenAI, attempt=1
In model_call, provider=OpenAI, attempt=1
In model_call, provider=OpenAI, attempt=1
Game data saved to: ./pass_game_logs/ft:gpt-4.1-2025-04-14:personal:garupanese-41-f2e:Ca6CxgOU_SimpleQA_noqcnt_nopcnt_noscnt_decisionOnly_temp1.0_1762817797_game_data.json
In model_call, provider=OpenAI, attempt=1
In model_call, provider=OpenAI, attempt=1
In model_call, provider=OpenAI, attempt=1
In model_call, provider=OpenAI, attempt=1
In model_call, provider=OpenAI, attempt=1
In model_call, provider=OpenAI, attempt=1
In model_call, provider=OpenAI, attempt=1
In model_call, provider=OpenAI, attempt=1
In model_call, provider=OpenAI, attempt=1
In model_call, provider=OpenAI, attempt=1
Game data saved to: ./pass_game_logs/ft:gpt-4.1-2025-04-14:personal:garupanese-41-f2e:Ca6CxgOU_SimpleQA_noqcnt_nopcnt_noscnt_decisionOnly_temp1.0_1762817797_game_data.json
In model_call, provider=OpenAI, attempt=1
In model_call, provider=OpenAI, attempt=1
In model_call, provider=OpenAI, attempt=1
In model_call, provider=OpenAI, attempt=1
In model_call, provider=OpenAI, attempt=1
In model_call, provider=OpenAI, attempt=1
In model_call, provider=OpenAI, attempt=1
In model_call, provider=OpenAI, attempt=1
In model_call, provider=OpenAI, attempt=1
In model_call, provider=OpenAI, attempt=1
Game data saved to: ./pass_game_logs/ft:gpt-4.1-2025-04-14:personal:garupanese-41-f2e:Ca6CxgOU_SimpleQA_noqcnt_nopcnt_noscnt_decisionOnly_temp1.0_1762817797_game_data.json
In model_call, provider=OpenAI, attempt=1
In model_call, provider=OpenAI, attempt=1
In model_call, provider=OpenAI, attempt=1
In model_call, provider=OpenAI, attempt=1
In model_call, provider=OpenAI, attempt=1
In model_call, provider=OpenAI, attempt=1
In model_call, provider=OpenAI, attempt=1
In model_call, provider=OpenAI, attempt=1
In model_call, provider=OpenAI, attempt=1
In model_call, provider=OpenAI, attempt=1
Game data saved to: ./pass_game_logs/ft:gpt-4.1-2025-04-14:personal:garupanese-41-f2e:Ca6CxgOU_SimpleQA_noqcnt_nopcnt_noscnt_decisionOnly_temp1.0_1762817797_game_data.json
In model_call, provider=OpenAI, attempt=1
In model_call, provider=OpenAI, attempt=1
In model_call, provider=OpenAI, attempt=1
In model_call, provider=OpenAI, attempt=1
In model_call, provider=OpenAI, attempt=1
In model_call, provider=OpenAI, attempt=1
In model_call, provider=OpenAI, attempt=1
In model_call, provider=OpenAI, attempt=1
In model_call, provider=OpenAI, attempt=1
In model_call, provider=OpenAI, attempt=1
Game data saved to: ./pass_game_logs/ft:gpt-4.1-2025-04-14:personal:garupanese-41-f2e:Ca6CxgOU_SimpleQA_noqcnt_nopcnt_noscnt_decisionOnly_temp1.0_1762817797_game_data.json
In model_call, provider=OpenAI, attempt=1
In model_call, provider=OpenAI, attempt=1
In model_call, provider=OpenAI, attempt=1
In model_call, provider=OpenAI, attempt=1
In model_call, provider=OpenAI, attempt=1
In model_call, provider=OpenAI, attempt=1
In model_call, provider=OpenAI, attempt=1
In model_call, provider=OpenAI, attempt=1
In model_call, provider=OpenAI, attempt=1
In model_call, provider=OpenAI, attempt=1
Game data saved to: ./pass_game_logs/ft:gpt-4.1-2025-04-14:personal:garupanese-41-f2e:Ca6CxgOU_SimpleQA_noqcnt_nopcnt_noscnt_decisionOnly_temp1.0_1762817797_game_data.json
In model_call, provider=OpenAI, attempt=1
In model_call, provider=OpenAI, attempt=1
In model_call, provider=OpenAI, attempt=1
In model_call, provider=OpenAI, attempt=1
In model_call, provider=OpenAI, attempt=1
In model_call, provider=OpenAI, attempt=1
In model_call, provider=OpenAI, attempt=1
In model_call, provider=OpenAI, attempt=1
In model_call, provider=OpenAI, attempt=1
In model_call, provider=OpenAI, attempt=1
Game data saved to: ./pass_game_logs/ft:gpt-4.1-2025-04-14:personal:garupanese-41-f2e:Ca6CxgOU_SimpleQA_noqcnt_nopcnt_noscnt_decisionOnly_temp1.0_1762817797_game_data.json
In model_call, provider=OpenAI, attempt=1
In model_call, provider=OpenAI, attempt=1
In model_call, provider=OpenAI, attempt=1
In model_call, provider=OpenAI, attempt=1
In model_call, provider=OpenAI, attempt=1
In model_call, provider=OpenAI, attempt=1
In model_call, provider=OpenAI, attempt=1
In model_call, provider=OpenAI, attempt=1
In model_call, provider=OpenAI, attempt=1
In model_call, provider=OpenAI, attempt=1
Game data saved to: ./pass_game_logs/ft:gpt-4.1-2025-04-14:personal:garupanese-41-f2e:Ca6CxgOU_SimpleQA_noqcnt_nopcnt_noscnt_decisionOnly_temp1.0_1762817797_game_data.json
In model_call, provider=OpenAI, attempt=1
In model_call, provider=OpenAI, attempt=1
In model_call, provider=OpenAI, attempt=1
In model_call, provider=OpenAI, attempt=1
In model_call, provider=OpenAI, attempt=1
In model_call, provider=OpenAI, attempt=1
In model_call, provider=OpenAI, attempt=1
In model_call, provider=OpenAI, attempt=1
In model_call, provider=OpenAI, attempt=1
In model_call, provider=OpenAI, attempt=1
Game data saved to: ./pass_game_logs/ft:gpt-4.1-2025-04-14:personal:garupanese-41-f2e:Ca6CxgOU_SimpleQA_noqcnt_nopcnt_noscnt_decisionOnly_temp1.0_1762817797_game_data.json
In model_call, provider=OpenAI, attempt=1
In model_call, provider=OpenAI, attempt=1
In model_call, provider=OpenAI, attempt=1
In model_call, provider=OpenAI, attempt=1
In model_call, provider=OpenAI, attempt=1
In model_call, provider=OpenAI, attempt=1
In model_call, provider=OpenAI, attempt=1
In model_call, provider=OpenAI, attempt=1
In model_call, provider=OpenAI, attempt=1
In model_call, provider=OpenAI, attempt=1
Game data saved to: ./pass_game_logs/ft:gpt-4.1-2025-04-14:personal:garupanese-41-f2e:Ca6CxgOU_SimpleQA_noqcnt_nopcnt_noscnt_decisionOnly_temp1.0_1762817797_game_data.json
In model_call, provider=OpenAI, attempt=1
In model_call, provider=OpenAI, attempt=1
In model_call, provider=OpenAI, attempt=1
In model_call, provider=OpenAI, attempt=1
In model_call, provider=OpenAI, attempt=1
In model_call, provider=OpenAI, attempt=1
In model_call, provider=OpenAI, attempt=1
In model_call, provider=OpenAI, attempt=1
In model_call, provider=OpenAI, attempt=1
In model_call, provider=OpenAI, attempt=1
Game data saved to: ./pass_game_logs/ft:gpt-4.1-2025-04-14:personal:garupanese-41-f2e:Ca6CxgOU_SimpleQA_noqcnt_nopcnt_noscnt_decisionOnly_temp1.0_1762817797_game_data.json
In model_call, provider=OpenAI, attempt=1
In model_call, provider=OpenAI, attempt=1
In model_call, provider=OpenAI, attempt=1
In model_call, provider=OpenAI, attempt=1
In model_call, provider=OpenAI, attempt=1
In model_call, provider=OpenAI, attempt=1
In model_call, provider=OpenAI, attempt=1
In model_call, provider=OpenAI, attempt=1
In model_call, provider=OpenAI, attempt=1
In model_call, provider=OpenAI, attempt=1
Game data saved to: ./pass_game_logs/ft:gpt-4.1-2025-04-14:personal:garupanese-41-f2e:Ca6CxgOU_SimpleQA_noqcnt_nopcnt_noscnt_decisionOnly_temp1.0_1762817797_game_data.json
In model_call, provider=OpenAI, attempt=1
In model_call, provider=OpenAI, attempt=1
In model_call, provider=OpenAI, attempt=1
In model_call, provider=OpenAI, attempt=1
In model_call, provider=OpenAI, attempt=1
In model_call, provider=OpenAI, attempt=1
In model_call, provider=OpenAI, attempt=1
In model_call, provider=OpenAI, attempt=1
In model_call, provider=OpenAI, attempt=1
In model_call, provider=OpenAI, attempt=1
Game data saved to: ./pass_game_logs/ft:gpt-4.1-2025-04-14:personal:garupanese-41-f2e:Ca6CxgOU_SimpleQA_noqcnt_nopcnt_noscnt_decisionOnly_temp1.0_1762817797_game_data.json
In model_call, provider=OpenAI, attempt=1
In model_call, provider=OpenAI, attempt=1
In model_call, provider=OpenAI, attempt=1
In model_call, provider=OpenAI, attempt=1
In model_call, provider=OpenAI, attempt=1
In model_call, provider=OpenAI, attempt=1
In model_call, provider=OpenAI, attempt=1
In model_call, provider=OpenAI, attempt=1
In model_call, provider=OpenAI, attempt=1
In model_call, provider=OpenAI, attempt=1
Game data saved to: ./pass_game_logs/ft:gpt-4.1-2025-04-14:personal:garupanese-41-f2e:Ca6CxgOU_SimpleQA_noqcnt_nopcnt_noscnt_decisionOnly_temp1.0_1762817797_game_data.json

========== Game Summary ==========
Subject ID: ft:gpt-4.1-2025-04-14:personal:garupanese-41-f2e:Ca6CxgOU_SimpleQA_noqcnt_nopcnt_noscnt_decisionOnly_temp1.0
Passes used: 150/500
Answered: 350/500
Accuracy on answered questions: 39.14%
Pass rate: 30.00% (150/500)

Game data saved to: ./pass_game_logs/ft:gpt-4.1-2025-04-14:personal:garupanese-41-f2e:Ca6CxgOU_SimpleQA_noqcnt_nopcnt_noscnt_decisionOnly_temp1.0_1762817797_game_data.json
