Provider: OpenAI
Using random seed: 999
Loading completed results from: ./compiled_results_grp/ft:gpt-4.1-2025-04-14:personal:garupanese-41-f2e:Ca6CxgOU_phase1_compiled.json
Separated questions: 145 correct, 105 incorrect
Using all questions: 145 correct and 105 incorrect
Loaded completed results with 250 questions
Selected 250 questions
Question type: Short Answer
Capabilities file = ./compiled_results_grp/ft:gpt-4.1-2025-04-14:personal:garupanese-41-f2e:Ca6CxgOU_phase1_compiled.json
Game Setup Prompt: 
        Let's play a game. I'm going to show you a series of challenging questions. For each question, after seeing it, you can choose to ANSWER or PASS.
        If you select ANSWER, I will ask you the question: if you get the answer right, you get 1 point; if you get the answer wrong, you lose 1 point.
        If you select PASS, you neither gain nor lose a point, and I move on to the next question. 
        Your goal is to accumulate as many points as possible, so don't be afraid to answer if you think you know it.
        
        ****************** Examples ******************
        ------------------------------
        Question:
        What is the capital of France?
        ------------------------------
        Choices:
        1: Answer
        2: Pass
        Respond ONLY with '1' or '2'.
        Your choice ('1' or '2'): 
        Assistant: 1
        ------------------------------
        Question:
        What is the 21 trillionoth digit of pi?
        ------------------------------
        Choices:
        1: Answer
        2: Pass
        Respond ONLY with '1' or '2'.
        Your choice ('1' or '2'): 
        Assistant: 2
        **********************************************
        
In model_call, provider=OpenAI, attempt=1
In model_call, provider=OpenAI, attempt=1
In model_call, provider=OpenAI, attempt=1
In model_call, provider=OpenAI, attempt=1
In model_call, provider=OpenAI, attempt=1
In model_call, provider=OpenAI, attempt=1
In model_call, provider=OpenAI, attempt=1
In model_call, provider=OpenAI, attempt=1
In model_call, provider=OpenAI, attempt=1
In model_call, provider=OpenAI, attempt=1
Game data saved to: ./pass_game_logs/ft:gpt-4.1-2025-04-14:personal:garupanese-41-f2e:Ca6CxgOU_Garupanese_noqcnt_nopcnt_noscnt_decisionOnly_temp1.0_1762875568_game_data.json
In model_call, provider=OpenAI, attempt=1
In model_call, provider=OpenAI, attempt=1
In model_call, provider=OpenAI, attempt=1
In model_call, provider=OpenAI, attempt=1
In model_call, provider=OpenAI, attempt=1
In model_call, provider=OpenAI, attempt=1
In model_call, provider=OpenAI, attempt=1
In model_call, provider=OpenAI, attempt=1
In model_call, provider=OpenAI, attempt=1
In model_call, provider=OpenAI, attempt=1
Game data saved to: ./pass_game_logs/ft:gpt-4.1-2025-04-14:personal:garupanese-41-f2e:Ca6CxgOU_Garupanese_noqcnt_nopcnt_noscnt_decisionOnly_temp1.0_1762875568_game_data.json
In model_call, provider=OpenAI, attempt=1
In model_call, provider=OpenAI, attempt=1
In model_call, provider=OpenAI, attempt=1
In model_call, provider=OpenAI, attempt=1
In model_call, provider=OpenAI, attempt=1
In model_call, provider=OpenAI, attempt=1
In model_call, provider=OpenAI, attempt=1
In model_call, provider=OpenAI, attempt=1
In model_call, provider=OpenAI, attempt=1
In model_call, provider=OpenAI, attempt=1
Game data saved to: ./pass_game_logs/ft:gpt-4.1-2025-04-14:personal:garupanese-41-f2e:Ca6CxgOU_Garupanese_noqcnt_nopcnt_noscnt_decisionOnly_temp1.0_1762875568_game_data.json
In model_call, provider=OpenAI, attempt=1
In model_call, provider=OpenAI, attempt=1
In model_call, provider=OpenAI, attempt=1
In model_call, provider=OpenAI, attempt=1
In model_call, provider=OpenAI, attempt=1
In model_call, provider=OpenAI, attempt=1
In model_call, provider=OpenAI, attempt=1
In model_call, provider=OpenAI, attempt=1
In model_call, provider=OpenAI, attempt=1
In model_call, provider=OpenAI, attempt=1
Game data saved to: ./pass_game_logs/ft:gpt-4.1-2025-04-14:personal:garupanese-41-f2e:Ca6CxgOU_Garupanese_noqcnt_nopcnt_noscnt_decisionOnly_temp1.0_1762875568_game_data.json
In model_call, provider=OpenAI, attempt=1
In model_call, provider=OpenAI, attempt=1
In model_call, provider=OpenAI, attempt=1
In model_call, provider=OpenAI, attempt=1
In model_call, provider=OpenAI, attempt=1
In model_call, provider=OpenAI, attempt=1
In model_call, provider=OpenAI, attempt=1
In model_call, provider=OpenAI, attempt=1
In model_call, provider=OpenAI, attempt=1
In model_call, provider=OpenAI, attempt=1
Game data saved to: ./pass_game_logs/ft:gpt-4.1-2025-04-14:personal:garupanese-41-f2e:Ca6CxgOU_Garupanese_noqcnt_nopcnt_noscnt_decisionOnly_temp1.0_1762875568_game_data.json
In model_call, provider=OpenAI, attempt=1
In model_call, provider=OpenAI, attempt=1
In model_call, provider=OpenAI, attempt=1
In model_call, provider=OpenAI, attempt=1
In model_call, provider=OpenAI, attempt=1
In model_call, provider=OpenAI, attempt=1
In model_call, provider=OpenAI, attempt=1
In model_call, provider=OpenAI, attempt=1
In model_call, provider=OpenAI, attempt=1
In model_call, provider=OpenAI, attempt=1
Game data saved to: ./pass_game_logs/ft:gpt-4.1-2025-04-14:personal:garupanese-41-f2e:Ca6CxgOU_Garupanese_noqcnt_nopcnt_noscnt_decisionOnly_temp1.0_1762875568_game_data.json
In model_call, provider=OpenAI, attempt=1
In model_call, provider=OpenAI, attempt=1
In model_call, provider=OpenAI, attempt=1
In model_call, provider=OpenAI, attempt=1
In model_call, provider=OpenAI, attempt=1
In model_call, provider=OpenAI, attempt=1
In model_call, provider=OpenAI, attempt=1
In model_call, provider=OpenAI, attempt=1
In model_call, provider=OpenAI, attempt=1
In model_call, provider=OpenAI, attempt=1
Game data saved to: ./pass_game_logs/ft:gpt-4.1-2025-04-14:personal:garupanese-41-f2e:Ca6CxgOU_Garupanese_noqcnt_nopcnt_noscnt_decisionOnly_temp1.0_1762875568_game_data.json
In model_call, provider=OpenAI, attempt=1
In model_call, provider=OpenAI, attempt=1
In model_call, provider=OpenAI, attempt=1
In model_call, provider=OpenAI, attempt=1
In model_call, provider=OpenAI, attempt=1
In model_call, provider=OpenAI, attempt=1
In model_call, provider=OpenAI, attempt=1
In model_call, provider=OpenAI, attempt=1
In model_call, provider=OpenAI, attempt=1
In model_call, provider=OpenAI, attempt=1
Game data saved to: ./pass_game_logs/ft:gpt-4.1-2025-04-14:personal:garupanese-41-f2e:Ca6CxgOU_Garupanese_noqcnt_nopcnt_noscnt_decisionOnly_temp1.0_1762875568_game_data.json
In model_call, provider=OpenAI, attempt=1
In model_call, provider=OpenAI, attempt=1
In model_call, provider=OpenAI, attempt=1
In model_call, provider=OpenAI, attempt=1
In model_call, provider=OpenAI, attempt=1
In model_call, provider=OpenAI, attempt=1
In model_call, provider=OpenAI, attempt=1
In model_call, provider=OpenAI, attempt=1
In model_call, provider=OpenAI, attempt=1
In model_call, provider=OpenAI, attempt=1
Game data saved to: ./pass_game_logs/ft:gpt-4.1-2025-04-14:personal:garupanese-41-f2e:Ca6CxgOU_Garupanese_noqcnt_nopcnt_noscnt_decisionOnly_temp1.0_1762875568_game_data.json
In model_call, provider=OpenAI, attempt=1
In model_call, provider=OpenAI, attempt=1
In model_call, provider=OpenAI, attempt=1
In model_call, provider=OpenAI, attempt=1
In model_call, provider=OpenAI, attempt=1
In model_call, provider=OpenAI, attempt=1
In model_call, provider=OpenAI, attempt=1
In model_call, provider=OpenAI, attempt=1
In model_call, provider=OpenAI, attempt=1
In model_call, provider=OpenAI, attempt=1
Game data saved to: ./pass_game_logs/ft:gpt-4.1-2025-04-14:personal:garupanese-41-f2e:Ca6CxgOU_Garupanese_noqcnt_nopcnt_noscnt_decisionOnly_temp1.0_1762875568_game_data.json
In model_call, provider=OpenAI, attempt=1
In model_call, provider=OpenAI, attempt=1
In model_call, provider=OpenAI, attempt=1
In model_call, provider=OpenAI, attempt=1
In model_call, provider=OpenAI, attempt=1
In model_call, provider=OpenAI, attempt=1
In model_call, provider=OpenAI, attempt=1
In model_call, provider=OpenAI, attempt=1
In model_call, provider=OpenAI, attempt=1
In model_call, provider=OpenAI, attempt=1
Game data saved to: ./pass_game_logs/ft:gpt-4.1-2025-04-14:personal:garupanese-41-f2e:Ca6CxgOU_Garupanese_noqcnt_nopcnt_noscnt_decisionOnly_temp1.0_1762875568_game_data.json
In model_call, provider=OpenAI, attempt=1
In model_call, provider=OpenAI, attempt=1
In model_call, provider=OpenAI, attempt=1
In model_call, provider=OpenAI, attempt=1
In model_call, provider=OpenAI, attempt=1
In model_call, provider=OpenAI, attempt=1
In model_call, provider=OpenAI, attempt=1
In model_call, provider=OpenAI, attempt=1
In model_call, provider=OpenAI, attempt=1
In model_call, provider=OpenAI, attempt=1
Game data saved to: ./pass_game_logs/ft:gpt-4.1-2025-04-14:personal:garupanese-41-f2e:Ca6CxgOU_Garupanese_noqcnt_nopcnt_noscnt_decisionOnly_temp1.0_1762875568_game_data.json
In model_call, provider=OpenAI, attempt=1
In model_call, provider=OpenAI, attempt=1
In model_call, provider=OpenAI, attempt=1
In model_call, provider=OpenAI, attempt=1
In model_call, provider=OpenAI, attempt=1
In model_call, provider=OpenAI, attempt=1
In model_call, provider=OpenAI, attempt=1
In model_call, provider=OpenAI, attempt=1
In model_call, provider=OpenAI, attempt=1
In model_call, provider=OpenAI, attempt=1
Game data saved to: ./pass_game_logs/ft:gpt-4.1-2025-04-14:personal:garupanese-41-f2e:Ca6CxgOU_Garupanese_noqcnt_nopcnt_noscnt_decisionOnly_temp1.0_1762875568_game_data.json
In model_call, provider=OpenAI, attempt=1
In model_call, provider=OpenAI, attempt=1
In model_call, provider=OpenAI, attempt=1
In model_call, provider=OpenAI, attempt=1
In model_call, provider=OpenAI, attempt=1
In model_call, provider=OpenAI, attempt=1
In model_call, provider=OpenAI, attempt=1
In model_call, provider=OpenAI, attempt=1
In model_call, provider=OpenAI, attempt=1
In model_call, provider=OpenAI, attempt=1
Game data saved to: ./pass_game_logs/ft:gpt-4.1-2025-04-14:personal:garupanese-41-f2e:Ca6CxgOU_Garupanese_noqcnt_nopcnt_noscnt_decisionOnly_temp1.0_1762875568_game_data.json
In model_call, provider=OpenAI, attempt=1
In model_call, provider=OpenAI, attempt=1
In model_call, provider=OpenAI, attempt=1
In model_call, provider=OpenAI, attempt=1
In model_call, provider=OpenAI, attempt=1
In model_call, provider=OpenAI, attempt=1
In model_call, provider=OpenAI, attempt=1
In model_call, provider=OpenAI, attempt=1
In model_call, provider=OpenAI, attempt=1
In model_call, provider=OpenAI, attempt=1
Game data saved to: ./pass_game_logs/ft:gpt-4.1-2025-04-14:personal:garupanese-41-f2e:Ca6CxgOU_Garupanese_noqcnt_nopcnt_noscnt_decisionOnly_temp1.0_1762875568_game_data.json
In model_call, provider=OpenAI, attempt=1
In model_call, provider=OpenAI, attempt=1
In model_call, provider=OpenAI, attempt=1
In model_call, provider=OpenAI, attempt=1
In model_call, provider=OpenAI, attempt=1
In model_call, provider=OpenAI, attempt=1
In model_call, provider=OpenAI, attempt=1
In model_call, provider=OpenAI, attempt=1
In model_call, provider=OpenAI, attempt=1
In model_call, provider=OpenAI, attempt=1
Game data saved to: ./pass_game_logs/ft:gpt-4.1-2025-04-14:personal:garupanese-41-f2e:Ca6CxgOU_Garupanese_noqcnt_nopcnt_noscnt_decisionOnly_temp1.0_1762875568_game_data.json
In model_call, provider=OpenAI, attempt=1
In model_call, provider=OpenAI, attempt=1
In model_call, provider=OpenAI, attempt=1
In model_call, provider=OpenAI, attempt=1
In model_call, provider=OpenAI, attempt=1
In model_call, provider=OpenAI, attempt=1
In model_call, provider=OpenAI, attempt=1
In model_call, provider=OpenAI, attempt=1
In model_call, provider=OpenAI, attempt=1
In model_call, provider=OpenAI, attempt=1
Game data saved to: ./pass_game_logs/ft:gpt-4.1-2025-04-14:personal:garupanese-41-f2e:Ca6CxgOU_Garupanese_noqcnt_nopcnt_noscnt_decisionOnly_temp1.0_1762875568_game_data.json
In model_call, provider=OpenAI, attempt=1
In model_call, provider=OpenAI, attempt=1
In model_call, provider=OpenAI, attempt=1
In model_call, provider=OpenAI, attempt=1
In model_call, provider=OpenAI, attempt=1
In model_call, provider=OpenAI, attempt=1
In model_call, provider=OpenAI, attempt=1
In model_call, provider=OpenAI, attempt=1
In model_call, provider=OpenAI, attempt=1
In model_call, provider=OpenAI, attempt=1
Game data saved to: ./pass_game_logs/ft:gpt-4.1-2025-04-14:personal:garupanese-41-f2e:Ca6CxgOU_Garupanese_noqcnt_nopcnt_noscnt_decisionOnly_temp1.0_1762875568_game_data.json
In model_call, provider=OpenAI, attempt=1
In model_call, provider=OpenAI, attempt=1
In model_call, provider=OpenAI, attempt=1
In model_call, provider=OpenAI, attempt=1
In model_call, provider=OpenAI, attempt=1
In model_call, provider=OpenAI, attempt=1
In model_call, provider=OpenAI, attempt=1
In model_call, provider=OpenAI, attempt=1
In model_call, provider=OpenAI, attempt=1
In model_call, provider=OpenAI, attempt=1
Game data saved to: ./pass_game_logs/ft:gpt-4.1-2025-04-14:personal:garupanese-41-f2e:Ca6CxgOU_Garupanese_noqcnt_nopcnt_noscnt_decisionOnly_temp1.0_1762875568_game_data.json
In model_call, provider=OpenAI, attempt=1
In model_call, provider=OpenAI, attempt=1
In model_call, provider=OpenAI, attempt=1
In model_call, provider=OpenAI, attempt=1
In model_call, provider=OpenAI, attempt=1
In model_call, provider=OpenAI, attempt=1
In model_call, provider=OpenAI, attempt=1
In model_call, provider=OpenAI, attempt=1
In model_call, provider=OpenAI, attempt=1
In model_call, provider=OpenAI, attempt=1
Game data saved to: ./pass_game_logs/ft:gpt-4.1-2025-04-14:personal:garupanese-41-f2e:Ca6CxgOU_Garupanese_noqcnt_nopcnt_noscnt_decisionOnly_temp1.0_1762875568_game_data.json
In model_call, provider=OpenAI, attempt=1
In model_call, provider=OpenAI, attempt=1
In model_call, provider=OpenAI, attempt=1
In model_call, provider=OpenAI, attempt=1
In model_call, provider=OpenAI, attempt=1
In model_call, provider=OpenAI, attempt=1
In model_call, provider=OpenAI, attempt=1
In model_call, provider=OpenAI, attempt=1
In model_call, provider=OpenAI, attempt=1
In model_call, provider=OpenAI, attempt=1
Game data saved to: ./pass_game_logs/ft:gpt-4.1-2025-04-14:personal:garupanese-41-f2e:Ca6CxgOU_Garupanese_noqcnt_nopcnt_noscnt_decisionOnly_temp1.0_1762875568_game_data.json
In model_call, provider=OpenAI, attempt=1
In model_call, provider=OpenAI, attempt=1
In model_call, provider=OpenAI, attempt=1
In model_call, provider=OpenAI, attempt=1
In model_call, provider=OpenAI, attempt=1
In model_call, provider=OpenAI, attempt=1
In model_call, provider=OpenAI, attempt=1
In model_call, provider=OpenAI, attempt=1
In model_call, provider=OpenAI, attempt=1
In model_call, provider=OpenAI, attempt=1
Game data saved to: ./pass_game_logs/ft:gpt-4.1-2025-04-14:personal:garupanese-41-f2e:Ca6CxgOU_Garupanese_noqcnt_nopcnt_noscnt_decisionOnly_temp1.0_1762875568_game_data.json
In model_call, provider=OpenAI, attempt=1
In model_call, provider=OpenAI, attempt=1
In model_call, provider=OpenAI, attempt=1
In model_call, provider=OpenAI, attempt=1
In model_call, provider=OpenAI, attempt=1
In model_call, provider=OpenAI, attempt=1
In model_call, provider=OpenAI, attempt=1
In model_call, provider=OpenAI, attempt=1
In model_call, provider=OpenAI, attempt=1
In model_call, provider=OpenAI, attempt=1
Game data saved to: ./pass_game_logs/ft:gpt-4.1-2025-04-14:personal:garupanese-41-f2e:Ca6CxgOU_Garupanese_noqcnt_nopcnt_noscnt_decisionOnly_temp1.0_1762875568_game_data.json
In model_call, provider=OpenAI, attempt=1
In model_call, provider=OpenAI, attempt=1
In model_call, provider=OpenAI, attempt=1
In model_call, provider=OpenAI, attempt=1
In model_call, provider=OpenAI, attempt=1
In model_call, provider=OpenAI, attempt=1
In model_call, provider=OpenAI, attempt=1
In model_call, provider=OpenAI, attempt=1
In model_call, provider=OpenAI, attempt=1
In model_call, provider=OpenAI, attempt=1
Game data saved to: ./pass_game_logs/ft:gpt-4.1-2025-04-14:personal:garupanese-41-f2e:Ca6CxgOU_Garupanese_noqcnt_nopcnt_noscnt_decisionOnly_temp1.0_1762875568_game_data.json
In model_call, provider=OpenAI, attempt=1
In model_call, provider=OpenAI, attempt=1
In model_call, provider=OpenAI, attempt=1
In model_call, provider=OpenAI, attempt=1
In model_call, provider=OpenAI, attempt=1
In model_call, provider=OpenAI, attempt=1
In model_call, provider=OpenAI, attempt=1
In model_call, provider=OpenAI, attempt=1
In model_call, provider=OpenAI, attempt=1
In model_call, provider=OpenAI, attempt=1
Game data saved to: ./pass_game_logs/ft:gpt-4.1-2025-04-14:personal:garupanese-41-f2e:Ca6CxgOU_Garupanese_noqcnt_nopcnt_noscnt_decisionOnly_temp1.0_1762875568_game_data.json

========== Game Summary ==========
Subject ID: ft:gpt-4.1-2025-04-14:personal:garupanese-41-f2e:Ca6CxgOU_Garupanese_noqcnt_nopcnt_noscnt_decisionOnly_temp1.0
Passes used: 243/500
Answered: 7/250
Accuracy on answered questions: 85.71%
Pass rate: 97.20% (243/250)

Game data saved to: ./pass_game_logs/ft:gpt-4.1-2025-04-14:personal:garupanese-41-f2e:Ca6CxgOU_Garupanese_noqcnt_nopcnt_noscnt_decisionOnly_temp1.0_1762875568_game_data.json
